{
  "schema_version": "2.3",
  "correspondence_id": "efsc_01J00000000000000000000013",
  "project_id": "efp_01J00000000000000000000001",
  "source_record_ref": "chat-import:turn-18:Workflow.md",
  "candidate_entries": [
    {
      "tree_revision_id": "eft_01J00000000000000000000005",
      "relative_path": "references/prior-workflow.md",
      "node_id": "efn_01J00000000000000000000003",
      "node_revision": 1
    },
    {
      "tree_revision_id": "eft_01J00000000000000000000005",
      "relative_path": "authorities/system-design/spec.md",
      "node_id": "efn_01J00000000000000000000002",
      "node_revision": 2
    }
  ],
  "proposed_selection": {
    "tree_revision_id": "eft_01J00000000000000000000005",
    "relative_path": "references/prior-workflow.md",
    "node_id": "efn_01J00000000000000000000003",
    "node_revision": 1
  },
  "evidence_refs": [
    "efa_01J00000000000000000000011",
    "authority:user-event-history#turn-18"
  ],
  "decision_ref": null,
  "unresolved_alternatives": [
    {
      "tree_revision_id": "eft_01J00000000000000000000005",
      "relative_path": "authorities/system-design/spec.md",
      "node_id": "efn_01J00000000000000000000002",
      "node_revision": 2
    }
  ],
  "created_at": "2026-07-15T12:12:00Z"
}
